{
  "brief_id": "BRIEF_20260319_190515_9048779d",
  "timestamp": "2026-03-20T01:05:15.154889+00:00",
  "status": "healthy",
  "source_snapshot": "TREND_20260319_190014_2b00b2da",
  "briefs": [
    {
      "title": "TechCrunch\u00a0Startup Battlefield 200 nominations\u00a0are still\u00a0open",
      "source": "TechCrunch AI",
      "category": "ai",
      "link": "https://techcrunch.com/2026/03/19/techcrunch-startup-battlefield-200-nominations-are-still-open/",
      "summary": "Nominate your startup, or one you know, for TechCrunch Startup Battlefield 200 before May 27. Chance to win $100,000 equity-free funding and VC access.",
      "claims": [
        "This trend focuses on: TechCrunch\u00a0Startup Battlefield 200 nominations\u00a0are still\u00a0open",
        "Key insight: Nominate your startup, or one you know, for TechCrunch Startup Battlefield 200 before May 27",
        "Source: TechCrunch AI (category: ai)",
        "This relates to commercial AI applications and industry developments",
        "This is general technology news coverage"
      ],
      "followups": [
        "What are the key players/companies mentioned?",
        "What is the timeline for this development?",
        "What are the potential implications for the industry?",
        "What AI models or techniques are involved?",
        "How does this compare to existing solutions?"
      ]
    },
    {
      "title": "Jeff Bezos reportedly wants $100 billion to buy and transform old manufacturing firms with AI",
      "source": "TechCrunch AI",
      "category": "ai",
      "link": "https://techcrunch.com/2026/03/19/jeff-bezos-reportedly-wants-100-billion-to-buy-and-transform-old-manufacturing-firms-with-ai/",
      "summary": "The Amazon magnate has a new project centered around acquiring industrial firms and revamping them with AI technology.",
      "claims": [
        "This trend focuses on: Jeff Bezos reportedly wants $100 billion to buy and transform old manufacturing firms with AI",
        "Key insight: The Amazon magnate has a new project centered around acquiring industrial firms and revamping them with AI technology",
        "Source: TechCrunch AI (category: ai)",
        "This relates to commercial AI applications and industry developments",
        "This is general technology news coverage"
      ],
      "followups": [
        "What are the key players/companies mentioned?",
        "What is the timeline for this development?",
        "What are the potential implications for the industry?",
        "What AI models or techniques are involved?",
        "How does this compare to existing solutions?"
      ]
    },
    {
      "title": "Meta rolls out new AI content enforcement systems while reducing reliance on third-party vendors",
      "source": "TechCrunch AI",
      "category": "ai",
      "link": "https://techcrunch.com/2026/03/19/meta-rolls-out-new-ai-content-enforcement-systems-while-reducing-reliance-on-third-party-vendors/",
      "summary": "Meta believes these AI systems can detect more violations with greater accuracy, better prevent scams, respond more quickly to real-world events, and reduce over-enforcement.",
      "claims": [
        "This trend focuses on: Meta rolls out new AI content enforcement systems while reducing reliance on third-party vendors",
        "Key insight: Meta believes these AI systems can detect more violations with greater accuracy, better prevent scams, respond more quickly to real-world events, and ",
        "Source: TechCrunch AI (category: ai)",
        "This relates to commercial AI applications and industry developments",
        "This appears to be a new announcement or product launch"
      ],
      "followups": [
        "What are the key players/companies mentioned?",
        "What is the timeline for this development?",
        "What are the potential implications for the industry?",
        "What AI models or techniques are involved?",
        "How does this compare to existing solutions?"
      ]
    },
    {
      "title": "DoorDash launches a new \u2018Tasks\u2019 app that pays couriers to submit videos to train AI",
      "source": "TechCrunch AI",
      "category": "ai",
      "link": "https://techcrunch.com/2026/03/19/doordash-launches-a-new-tasks-app-that-pays-couriers-to-submit-videos-to-train-ai/",
      "summary": "Delivery couriers will be able to earn money by completing activities like filming everyday tasks or recording themselves speaking in another language.",
      "claims": [
        "This trend focuses on: DoorDash launches a new \u2018Tasks\u2019 app that pays couriers to submit videos to train AI",
        "Key insight: Delivery couriers will be able to earn money by completing activities like filming everyday tasks or recording themselves speaking in another language",
        "Source: TechCrunch AI (category: ai)",
        "This relates to commercial AI applications and industry developments",
        "This appears to be a new announcement or product launch"
      ],
      "followups": [
        "What are the key players/companies mentioned?",
        "What is the timeline for this development?",
        "What are the potential implications for the industry?",
        "What AI models or techniques are involved?",
        "How does this compare to existing solutions?"
      ]
    },
    {
      "title": "Multiverse Computing pushes its compressed AI models into the mainstream",
      "source": "TechCrunch AI",
      "category": "ai",
      "link": "https://techcrunch.com/2026/03/19/multiverse-computing-pushes-its-compressed-ai-models-into-the-mainstream/",
      "summary": "After compressing models from major AI labs, including OpenAI, Meta, DeepSeek, and Mistral AI, Multiverse Computing has launched both an app that showcases the capabilities of its compressed models an",
      "claims": [
        "This trend focuses on: Multiverse Computing pushes its compressed AI models into the mainstream",
        "Key insight: After compressing models from major AI labs, including OpenAI, Meta, DeepSeek, and Mistral AI, Multiverse Computing has launched both an app that show",
        "Source: TechCrunch AI (category: ai)",
        "This relates to commercial AI applications and industry developments",
        "This is general technology news coverage"
      ],
      "followups": [
        "What are the key players/companies mentioned?",
        "What is the timeline for this development?",
        "What are the potential implications for the industry?",
        "What AI models or techniques are involved?",
        "How does this compare to existing solutions?"
      ]
    }
  ],
  "meta": {
    "version": "1.0.0",
    "service": "deep_research_agent",
    "story_id": "SKYBEAM-STORY-007",
    "brief_count": 5,
    "degraded": false
  }
}